{
    "id": "BAKERS_CLUB_8_5OZ_MIXED_BLACK_AND_WHITE_SESAME_SEEDS_TUXEDO_",
    "asin": "B089PZSJ28",
    "name": "Bakers Club 8.5oz Mixed Black and White Sesame Seeds - Tuxedo blend for Sushi, Tuna, Stir Fry, Bread",
    "url": "https://www.amazon.com/Bakers-Club-Mixed-Black-White-Sesame-Seeds/dp/B089PZSJ28",
    "prices": [
        {
            "price": 9.99,
            "date": "2026-03-31",
            "rating": 4.7,
            "reviewCount": 233,
            "isPrime": true,
            "availability": "In Stock",
            "delivery": "FREE delivery Thursday, April 2"
        }
    ],
    "brand": "BAKERS CLUB EST 1991",
    "quantity": 8.5,
    "unit": "Ounce",
    "dimensions": ": ‎ 5.67 x 2.48 x 2.48 inches; 8.5 ounces",
    "manufacturer": ": ‎ Bakers Club"
}
