{
    "id": "ARM_HAMMER_BAKING_SODA_MADE_IN_USA_IDEAL_FOR_BAKING_PURE_NAT",
    "asin": "B0CJCXLDSP",
    "name": "ARM & HAMMER Baking Soda Made in USA, Ideal for Baking, Pure & Natural, 2.7lb Bag",
    "url": "https://www.amazon.com/Arm-Hammer-Baking-Soda/dp/B0CJCXLDSP",
    "prices": [
        {
            "price": 7.99,
            "date": "2026-03-31",
            "rating": 4.8,
            "reviewCount": 9977,
            "isPrime": true,
            "availability": "In Stock",
            "delivery": "FREE delivery Today"
        }
    ],
    "brand": "Arm & Hammer",
    "dimensions": ": ‎ 6.75 x 3 x 9.75 inches; 2.7 Pounds",
    "manufacturer": ": ‎ Church & Dwight"
}
