{
    "id": "DOMINO_PREMIUM_PURE_CANE_LIGHT_BROWN_SUGAR_16_OZ",
    "asin": "B01GHECG68",
    "name": "Domino Premium Pure Cane Light Brown Sugar, 16 Oz",
    "url": "https://www.amazon.com/Domino-Premium-Pure-Cane-Light-Brown-Sugar/dp/B01GHECG68",
    "prices": [
        {
            "price": 1.74,
            "date": "2026-03-31",
            "rating": 4.8,
            "reviewCount": 2682,
            "isPrime": true,
            "availability": "In Stock"
        }
    ],
    "brand": "Domino",
    "quantity": 16,
    "unit": "Ounce",
    "dimensions": ": ‎ 1.8 x 3.8 x 6.5 inches; 16 ounces",
    "upc": ": ‎ 049200056752",
    "manufacturer": ": ‎ DOMINO FOODS INC"
}
