{
    "id": "KIKKOMAN_TRADITIONALLY_BREWED_SOY_SAUCE_ALL_PURPOSE_SEASONIN",
    "asin": "B00558RHB2",
    "name": "Kikkoman - Traditionally Brewed Soy Sauce, All Purpose Seasoning - 1 Gallon (Pack of 1)",
    "url": "https://www.amazon.com/Kikkoman-Soy-Sauce/dp/B00558RHB2",
    "prices": [
        {
            "price": 25.7,
            "date": "2026-03-31",
            "rating": 4.7,
            "reviewCount": 1985,
            "isPrime": true,
            "availability": "In Stock"
        }
    ],
    "brand": "Kikkoman",
    "quantity": 512,
    "unit": "Fluid Ounces",
    "dimensions": ": ‎ 8 x 6 x 12 inches; 9.89 Pounds",
    "upc": ": ‎ 041390001710",
    "manufacturer": ": ‎ Kikkoman"
}
