{
    "id": "NOW_FOODS_PUMPKIN_SEEDS_RAW_AND_UNSALTED_1_POUND",
    "asin": "B001395NZ4",
    "name": "NOW Foods, Pumpkin Seeds, Raw and Unsalted, 1-Pound",
    "url": "https://www.amazon.com/NOW-Foods-Pumpkin-Seeds-Raw-Unsalted/dp/B001395NZ4",
    "prices": [
        {
            "price": 8.99,
            "date": "2026-03-31",
            "rating": 4.8,
            "reviewCount": 5302,
            "isPrime": true,
            "availability": "In Stock"
        }
    ],
    "brand": "NOW Foods",
    "quantity": 16,
    "unit": "Ounce",
    "dimensions": ": ‎ 5.85 x 9.25 x 2.8 inches; 1 Pounds",
    "upc": ": ‎ 733739070258",
    "manufacturer": ": ‎ NOW Foods"
}
