{
    "id": "BOB_S_RED_MILL_GLUTEN_FREE_OLD_FASHIONED_ROLLED_OATS_32OZ_PA",
    "asin": "B07D9RLKCK",
    "name": "Bob's Red Mill Gluten Free Old Fashioned Rolled Oats, 32oz (Pack of 4)",
    "url": "https://www.amazon.com/Bobs-Red-Mill-Gluten-Free-Rolled-Oats/dp/B07D9RLKCK",
    "prices": [
        {
            "price": 23.92,
            "date": "2026-03-31",
            "rating": 4.8,
            "reviewCount": 6049,
            "isPrime": true,
            "availability": "In Stock"
        }
    ],
    "brand": "Bob's Red Mill",
    "quantity": 128,
    "unit": "Ounce",
    "dimensions": ": ‎ 38.08 x 30.48 x 71.12 inches; 8 Pounds",
    "manufacturer": ": ‎ Bob's Red Mill Natural Foods, Inc."
}
