{
    "id": "GOLD_MEDAL_ALL_PURPOSE_FLOUR_BAKING_FLOUR_5_LB_BAG",
    "asin": "B000PL2W0U",
    "name": "Gold Medal All Purpose Flour, Baking Flour, 5 lb Bag",
    "url": "https://www.amazon.com/Gold-Medal-All-Purpose-Flour/dp/B000PL2W0U",
    "prices": [
        {
            "price": 3.97,
            "date": "2026-03-31",
            "rating": 4.7,
            "reviewCount": 14148,
            "isPrime": true
        }
    ],
    "brand": "Gold Medal",
    "quantity": 80,
    "unit": "Ounce",
    "dimensions": ": ‎ 4.13 x 5.5 x 7.5 inches; 0.16 ounces",
    "upc": ": ‎ 016000106109",
    "manufacturer": ": ‎ General Mills"
}
