{
    "id": "FUSION_NAPA_VALLEY_VERJUS_BLANC_JUICE_OF_UNRIPE_GRAPES_25_35",
    "asin": "B07L6TC8N6",
    "name": "Fusion Napa Valley Verjus Blanc: Juice of Unripe Grapes, 25.35 fl.Ounce (750 ml) (2 Pack)",
    "url": "https://www.amazon.com/Fusion-Napa-Valley-Verjus-Blanc/dp/B07L6TC8N6",
    "prices": [
        {
            "price": 39.99,
            "date": "2026-03-31",
            "rating": 4.2,
            "reviewCount": 61,
            "isPrime": false
        }
    ],
    "brand": "Fusion",
    "quantity": 50.7,
    "unit": "Fluid Ounces",
    "dimensions": ": ‎ 12.4 x 7.44 x 5.55 inches; 5.97 Pounds"
}
