{
    "id": "FLEISCHMANN_S_YEAST_ACTIVE_DRY_0_75_OUNCE_PACKET_PACK_OF_9",
    "asin": "B001EQ5770",
    "name": "Fleischmann's Yeast, Active, Dry, 0.75-Ounce Packet (Pack of 9)",
    "url": "https://www.amazon.com/Fleischmanns-Active-Dry-Yeast/dp/B001EQ5770",
    "prices": [
        {
            "price": 8.89,
            "date": "2026-03-31",
            "rating": 4.7,
            "reviewCount": 1614,
            "isPrime": false
        }
    ],
    "brand": "Fleischmann's",
    "quantity": 6.75,
    "unit": "Ounce",
    "dimensions": "6 x 5 x 4 inches; 0.75 ounces",
    "upc": "0.07 Kilograms",
    "manufacturer": "Fleischmann's"
}
