{
    "id": "ORGANIC_CACAO_POWDER_UNSWEETENED_1_LB_454_G",
    "asin": "B00HES9CMS",
    "name": "Organic Cacao Powder, Unsweetened, 1 lb (454 g)",
    "url": "https://www.amazon.com/Organic-Cacao-Powder-Unsweetened/dp/B00HES9CMS",
    "prices": [
        {
            "price": 18.42,
            "date": "2026-03-31",
            "rating": 4.6,
            "reviewCount": 25191,
            "isPrime": true,
            "availability": "In Stock",
            "delivery": "FREE delivery Today"
        }
    ],
    "brand": "Viva Naturals",
    "quantity": 16,
    "unit": "Ounce",
    "dimensions": ": ‎ 7 x 10.63 x 2.88 inches; 1 Pounds",
    "upc": ": ‎ 794168524569",
    "manufacturer": ": ‎ Viva Naturals"
}
