{
    "id": "ORGANIC_GARLIC_POWDER_3_LB",
    "asin": "B0BXYB635P",
    "name": "Organic Garlic Powder, 3 lb",
    "url": "https://www.amazon.com/Organic-Garlic-Powder-Bulk/dp/B0BXYB635P",
    "prices": [
        {
            "price": 24.95,
            "date": "2026-03-31",
            "rating": 4.8,
            "reviewCount": 692,
            "isPrime": true,
            "availability": "In Stock"
        }
    ],
    "brand": "Micro Ingredients",
    "quantity": 48,
    "unit": "Ounce",
    "dimensions": ": ‎ 12.52 x 9.33 x 3.66 inches; 3 Pounds",
    "upc": ": ‎ 850015616686",
    "manufacturer": ": ‎ Micro Ingredients"
}
