{
    "id": "KIKKOMAN_MIRIN_17_FL_OZ",
    "asin": "B0002YB210",
    "name": "Kikkoman, Mirin, 17 Fl Oz",
    "url": "https://www.amazon.com/Kikkoman-Mirin/dp/B0002YB210",
    "prices": [
        {
            "price": 9.13,
            "date": "2026-03-31",
            "rating": 4.7,
            "reviewCount": 2706,
            "isPrime": true,
            "availability": "In Stock"
        }
    ],
    "brand": "Kikkoman",
    "quantity": 17,
    "unit": "Fluid Ounces",
    "dimensions": ": ‎ 3 x 3 x 7.87 inches; 1.06 Pounds",
    "upc": ": ‎ 011152263373",
    "manufacturer": ": ‎ Kikkoman"
}
