{
    "id": "RANI_PEANUTS_RAW_WHOLE_WITH_SKIN_UNCOOKED_UNSALTED_80OZ_5LBS",
    "asin": "B07TPBZPSV",
    "name": "Rani Peanuts, Raw Whole With Skin (uncooked, unsalted) 80oz (5lbs) 2.27kg Bulk",
    "url": "https://www.amazon.com/Rani-Peanuts-Raw-Whole-Skin/dp/B07TPBZPSV",
    "prices": [
        {
            "price": 19.99,
            "date": "2026-03-31",
            "rating": 4.6,
            "reviewCount": 4069,
            "isPrime": true,
            "availability": "In Stock"
        }
    ],
    "brand": "Rani Brand Authentic Indian Products",
    "quantity": 80,
    "unit": "Ounce",
    "dimensions": ": ‎ 13.03 x 9.29 x 2.83 inches; 5 Pounds",
    "upc": ": ‎ 680901052232",
    "manufacturer": ": ‎ Rani Foods"
}
