{
    "id": "TRUE_ORGANIC_BLACK_PEPPER_GROUND_1_LB_GLUTEN_FREE_PREMIUM_GR",
    "asin": "B088PJ849P",
    "name": "True Organic Black Pepper Ground, 1 lb, Gluten-Free Premium Grade, Fine Ground Pepper USDA & Kosher",
    "url": "https://www.amazon.com/True-Organic-Black-Pepper-Ground/dp/B088PJ849P",
    "prices": [
        {
            "price": 13.95,
            "date": "2026-03-31",
            "rating": 4.7,
            "reviewCount": 336,
            "isPrime": true,
            "availability": "In Stock",
            "delivery": "FREE delivery Today"
        }
    ],
    "brand": "True Organic",
    "quantity": 16,
    "unit": "Ounce",
    "dimensions": ": ‎ 9.84 x 7.05 x 2.28 inches; 1 Pounds",
    "upc": ": ‎ 091128998218",
    "manufacturer": ": ‎ True Organic"
}
