{
    "id": "HEINZ_USA_KETCHUP_BOTTLE_GLASS",
    "asin": "B00FIUCGAY",
    "name": "Heinz USA KETCHUP BOTTLE GLASS",
    "url": "https://www.amazon.com/Heinz-Ketchup/dp/B00FIUCGAY",
    "prices": [
        {
            "price": 8.94,
            "date": "2026-03-31",
            "rating": 4.1,
            "reviewCount": 94,
            "isPrime": true,
            "availability": "In Stock"
        }
    ],
    "brand": "HEINZ",
    "quantity": 336,
    "unit": "Ounce",
    "dimensions": ": ‎ 10.35 x 3.86 x 2.95 inches; 1.34 Pounds"
}
