{
    "id": "ISESO_MIYAKO_KOJI_1KG",
    "asin": "B004FHB5OO",
    "name": "IseSo Miyako Koji 1kg",
    "url": "https://www.amazon.com/IseSo-Miyako-Koji-1kg/dp/B004FHB5OO",
    "prices": [
        {
            "price": 26.1,
            "date": "2026-03-31",
            "rating": 4.7,
            "reviewCount": 2535,
            "isPrime": true,
            "availability": "In Stock"
        }
    ],
    "brand": "Isesou",
    "quantity": 35.27,
    "unit": "Ounce",
    "dimensions": ": ‎ 1.73 x 11.22 x 8.27 inches; 2.25 Pounds",
    "manufacturer": ": ‎ Iseso Co., Ltd."
}
