{
    "id": "MALDON_SALT_SEA_SALT_FLAKES_20_OZ_570_G_RESEALABLE_TUB",
    "asin": "B086XGH24W",
    "name": "Maldon Salt, Sea Salt Flakes, 20 oz (570 g), Resealable Tub",
    "url": "https://www.amazon.com/Maldon-Flaky-Sea-Salt/dp/B086XGH24W",
    "prices": [
        {
            "price": 14.99,
            "date": "2026-03-31",
            "rating": 4.8,
            "reviewCount": 63809,
            "isPrime": true,
            "availability": "In Stock",
            "delivery": "FREE delivery Today"
        }
    ],
    "brand": "Maldon",
    "quantity": 20,
    "unit": "Ounce",
    "dimensions": ": ‎ 4.88 x 4.88 x 5 inches; 1.26 Pounds",
    "upc": ": ‎ 847972000245",
    "manufacturer": ": ‎ Maldon Salt Company"
}
