{
    "id": "INCA_S_FOOD_AJI_AMARILLO_YELLOW_HOT_PEPPER_PASTE_7_5_OZ",
    "asin": "B00MHW9GFE",
    "name": "Inca's Food Aji Amarillo Yellow Hot Pepper Paste - 7.5 oz",
    "url": "https://www.amazon.com/Incas-Food-Aji-Amarillo-Yellow/dp/B00MHW9GFE",
    "prices": [
        {
            "price": 9.21,
            "date": "2026-03-31",
            "rating": 4.4,
            "reviewCount": 504,
            "isPrime": true,
            "availability": "In Stock",
            "delivery": "FREE delivery Today 2 PM - 6 PM"
        }
    ],
    "brand": "Inca's Food",
    "quantity": 7.5,
    "unit": "Ounce",
    "dimensions": ": ‎ 5.39 x 3.46 x 3.35 inches; 7.5 ounces",
    "upc": ": ‎ 729955568570"
}
