{
    "id": "MIZKAN_VINEGAR_SUSHI_SEASONING_FOR_SUSHI_OR_SALAD_24_FL_OZ_7",
    "asin": "B01ICROLXE",
    "name": "Mizkan Vinegar Sushi Seasoning for Sushi or Salad - 24 fl oz (710ml)",
    "url": "https://www.amazon.com/Mizkan-Sushi-Vinegar/dp/B01ICROLXE",
    "prices": [
        {
            "price": 14.69,
            "date": "2026-03-31",
            "rating": 4.7,
            "reviewCount": 1274,
            "isPrime": true,
            "availability": "In Stock"
        }
    ],
    "brand": "Mizkan",
    "quantity": 24,
    "unit": "Fluid Ounces",
    "dimensions": ": ‎ 10 x 2.68 x 2.68 inches; 1.1 Pounds"
}
