{
    "id": "HERBAILA_CREAM_OF_TARTAR_FOR_BAKING_1LB_GLUTEN_FREE_PREMIUM_",
    "asin": "B0B1916XLS",
    "name": "Herbaila Cream of Tartar for Baking 1lb, Gluten Free, Premium All Natural Food-grade",
    "url": "https://www.amazon.com/Herbaila-Cream-Tartar-Baking/dp/B0B1916XLS",
    "prices": [
        {
            "price": 9.94,
            "date": "2026-03-31",
            "rating": 4.7,
            "reviewCount": 1220,
            "isPrime": true,
            "availability": "In Stock",
            "delivery": "FREE delivery Today"
        }
    ],
    "brand": "Herbaila",
    "quantity": 16,
    "unit": "Ounce",
    "dimensions": ": ‎ 10.98 x 7.64 x 4.29 inches; 1 Pounds",
    "upc": ": ‎ 810073690677",
    "manufacturer": ": ‎ Herbaila"
}
