{
    "id": "BOB_S_RED_MILL_ORGANIC_BUCKWHEAT_FLOUR_22OZ_PACK_OF_4_NON_GM",
    "asin": "B07XF8XBYL",
    "name": "Bob's Red Mill Organic Buckwheat Flour, 22oz (Pack of 4) - Non GMO, Whole Grain, Vegan, Kosher",
    "url": "https://www.amazon.com/Bobs-Red-Mill-Buckwheat-Flour/dp/B07XF8XBYL",
    "prices": [
        {
            "price": 32.84,
            "date": "2026-03-31",
            "rating": 4.7,
            "reviewCount": 1160,
            "isPrime": true,
            "availability": "In Stock",
            "delivery": "FREE delivery Tomorrow"
        }
    ],
    "brand": "Bob's Red Mill",
    "quantity": 1,
    "unit": "Count",
    "dimensions": ": ‎ 3.94 x 3.94 x 3.94 inches; 5.5 Pounds",
    "manufacturer": ": ‎ Bob's Red Mill Natural Foods, Inc."
}
