{
    "id": "SHIRAKIKU_MISO_SHIRO_WHITE_SOY_BEAN_PASTE_35_27_OUNCE_BAGS_P",
    "asin": "B001FWXLYE",
    "name": "Shirakiku Miso Shiro (white) Soy Bean Paste, 35.27-Ounce Bags (Pack of 2)",
    "url": "https://www.amazon.com/Shirakiku-Shiro-White-Miso-Paste/dp/B001FWXLYE",
    "prices": [
        {
            "price": 20.2,
            "date": "2026-03-31",
            "rating": 4.6,
            "reviewCount": 692,
            "isPrime": true,
            "availability": "Only 11 left in stock"
        }
    ],
    "brand": "Shirakiku",
    "quantity": 70.5,
    "unit": "Ounce",
    "dimensions": ": ‎ 11.57 x 5.63 x 4.13 inches; 2.2 Pounds",
    "upc": ": ‎ 074410279127",
    "manufacturer": ": ‎ Shirakiku"
}
